CVE-2001-0609++ibm++exploitdb-1803	gain elevated privileges	attain root privileges and execute arbitrary code	0
CVE-2012-2112++openwall++nvd-3017	failing to properly encode the output	exception messages	0
CVE-2013-1809++openwall++nvd-474	a (temorary files ) directory hijack	move or manipulate directory contents or perform symlink attacks	1
CVE-2011-0003++ibm++nvd-1093	"""hijack the victim's click actions and possibly launch further attacks against the victim"""	unspecified vectors	0
CVE-2000-0329++exploitdb++nvd-1057	splitting up our code into two functions	"aka the ""active setup control "" vulnerability"	0
CVE-2009-1194++openwall++nvd-3270	heap allocation size	as demonstrated by a long document.location value in firefox	0
CVE-2016-6185++ibm++openwall-413	sending specially crafted data to the xsloader component	uses caller() information to locate the .so file to load	0
CVE-2017-1000083++exploitdb++openwall-1202	create the malicious .cbt file run	creating a tar archive with an embedded file	0
CVE-2008-3701++ibm++nvd-364	send specially-crafted sql statements to the index.php script using the customfieldlinkid parameter	the customfieldlinkid parameter in a delcflink action	1
CVE-2004-1857++ibm++nvd-1136	"create a specially-crafted url request to the setinfo.hts script containing \\""dot dot\\"" sequences (../) to traverse directories and view arbitrary files outside of the web root directory and execute arbitrary hts files on the system"	a .. (dot dot ) in the setinclude parameter .	1
CVE-2012-2127++ibm++openwall-2759	making many connections to a daemon that uses pid namespaces to isolate clients	vsftpd	1
CVE-2010-3859++ibm++nvd-1369	sending a specially-crafted sendmsg() call using tipc sockets	a crafted sendmsg call that triggers a heap-based buffer overflow	0
CVE-2015-6806++ibm++openwall-1489	sending a specially-crafted request	"displaying a file with ""cat "" inside screen"	0
CVE-2008-2931++ibm++nvd-2245	gain elevated privileges or cause a denial of service	modifying the properties of a mountpoint	0
CVE-2010-5001++exploitdb++nvd-2496	send emails to contacts with the built-in email client	the id parameter	0
CVE-2012-5002++exploitdb++nvd-2704	supplying a long string of data to the user command	a long user ftp command	1
CVE-2008-1914++ibm++nvd-3114	sending an overly long http get request to tcp port 6080	a long uri in a request to tcp port 6080	1
CVE-2013-4508++openwall++nvd-1411	using vulnerable cipher	inserting packets into the client-server data stream or obtain sensitive information	0
CVE-2014-9016++ibm++nvd-214	sending a specially-crafted request	a crafted request	1
CVE-2012-2573++exploitdb++nvd-1980	send an email to the victim with the payload in the e-mail body	"or (7 ) a data : url in the content attribute of an http-equiv=""refresh "" meta element"	0
CVE-2014-2364++exploitdb++nvd-2460	user controlled data through the getcolor function	(10 ) setbaud	0
CVE-2012-4444++openwall++nvd-2932	accepting overlapping fragmented ipv6 packets	overlapping ipv6 fragments	1
CVE-2012-1112++openwall++nvd-694	include a file from the targeted host	a .. (dot dot ) in the select_users_template parameter to index.php .	0
CVE-2006-6493++ibm++nvd-3378	sending an ldap bind request containing overly long credential data	an ldap bind request using the ldap_auth_krbv41 authentication method and long credential data	1
CVE-2005-2842++ibm++nvd-1317	sending a specially-crafted packet to tcp port 6129 containing an overly long username value	the username	0
CVE-2008-5235++openwall++nvd-2665	vectors related to (1 ) a crafted ebml element    length processed by the parse_block_group function in    demux_matroska.c ; (2 ) a certain combination of sps	a crafted real media file	0
CVE-2003-0647++exploitdb++nvd-2745	sending 2 gigabytes of data to the device	an extremely long (2gb ) http get request	0
CVE-2017-12920++ibm++openwall-1454	persuading a victim to open a specially-crafted file	manipulating flashpix images	0
CVE-2007-5996++ibm++nvd-406	send specially-crafted sql statements to the searchresult.php script using the sbcat_id parameter	the sbcat_id parameter	1
CVE-2008-1832++openwall++nvd-1447	a symlink attack on the csvers temporary file	a symlink attack on the csvers temporary file	1
CVE-2002-2296++ibm++exploitdb-747	"and possibly modify the victim's password"""	create a malicious link to the login page of a site hosting the web forum	0
CVE-2006-5094++ibm++nvd-2050	send a specially-crafted url request to the functions_kb.php script using the phpbb_root_path parameter to specify a malicious file from a remote system	a url in the phpbb_root_path parameter	0
CVE-2013-4522++ibm++nvd-2749	sending a specially-crafted request	requesting a file that had been previously retrieved	0
CVE-2013-2074++ibm++openwall-2432	the printing out of the url when encountering an internal server error	include the username and password (if supplied ) to the    resource	0
CVE-2015-6127++ibm++nvd-3130	persuading a victim to open a specially-crafted file	a crafted	0
CVE-2011-1944++ibm++nvd-1704	persuading a victim to open a specially-crafted xml file	a crafted xml file that triggers a heap-based buffer overflow when adding a new namespace node	1
CVE-2007-6581++ibm++nvd-2269	send a specially-crafted url request to multiple scripts using the global_lang parameter to specify a malicious file from the local system	a .. (dot dot ) in the global_lang parameter to (1 ) header_album.php	0
CVE-2016-7185++exploitdb++nvd-3224	create a drive letter symbolic link	a crafted application	0
CVE-2004-1121++exploitdb++nvd-262	display false information in the status bar of an unsuspecting user	table tags	0
CVE-2009-3050++ibm++nvd-903	persuading a victim to process a specially-crafted html document containing an specially-crafted media size comment	a long media size comment	0
CVE-2010-4598++exploitdb++nvd-2357	download files from the disk where the server is installed through directory traversal	a .. (dot dot ) in the file_name parameter in an open request .	0
CVE-2018-11787++ibm++nvd-1631	sending a specially-crafted request	a web browser	0
CVE-2014-4717++ibm++nvd-423	persuading an authenticated user to visit a malicious web site	the (1 ) ssba_share_text parameter in a save action to wp-admin/options-general.php	0
CVE-2013-4494++ibm++openwall-1944	a lock order reversal error in page_alloc_lock and grant_table.lock	a malicious guest administrator	0
CVE-2009-1194++openwall++nvd-3269	heap allocation size	a long glyph string that triggers a heap-based buffer overflow	1
CVE-2015-0291++ibm++nvd-717	connecting to a server and renegotiating with an invalid clienthello signature algorithms extension	using an invalid signature_algorithms extension in the clienthello message during a renegotiation	0
CVE-2008-1080++ibm++openwall-136	persuading a victim to visit a malicious web page and type target filename characters	images that contain custom comments	0
CVE-2008-3489++ibm++exploitdb-81	send specially-crafted sql statements using the pxl cookie parameter	pass the login	0
CVE-2009-0295++ibm++nvd-3018	send specially-crafted sql statements to the index.php script using the id parameter	the id parameter	0
CVE-2011-0708++openwall++nvd-1200	"""craft the value of the 'components ' variable (int )"""	an image with a crafted image file directory (ifd ) that triggers a buffer over-read	0
CVE-2010-0012++openwall++nvd-3340	processing crafted torrent files	a .. (dot dot ) in a pathname within a .torrent file .	0
CVE-2016-5418++ibm++openwall-1110	the improper handling of hardlink archive entries of non-zero size	"""placing our delta in ctrl[0 ] (or       ctrl[1])       * will easily bypass bspatch(1)'s own sanity checks"""	0
CVE-2017-15367++exploitdb++nvd-99	escalate privileges on the server	depending on configuration	1
CVE-2009-3323++ibm++nvd-3081	send a specially-crafted url request to the common_functions.php	(3 ) lib_stats.php	1
CVE-2008-2147++openwall++nvd-843	a malicious library	a malicious library under the modules / or plugins / subdirectories of the current working directory	0
CVE-2006-3969++ibm++nvd-3069	using the mosconfig_absolute_path parameter to specify a malicious file from a remote system	a url in the mosconfig_absolute_path parameter	1
CVE-2012-3355++ibm++openwall-1348	creating a symbolic link from a temporary file to various files on the system	loading the html template files	0
CVE-2009-0386++openwall++nvd-2259	a malformed quicktime media .mov file	crafted composition time to sample (ctts ) atom data in a malformed quicktime media	0
CVE-2016-8752++ibm++nvd-638	pointing to uris like /js and /img	pointing to uris like /js and /img	1
CVE-2008-1483++ibm++openwall-731	"""obtain the mit-magic-cookie and hijack other user's sessions"""	causing ssh to set display to :10	0
CVE-2016-2178++openwall++nvd-1143	follows a non-constant	a timing side-channel attack	0
CVE-2007-2820++ibm++nvd-2035	persuading a victim to visit a specially-crafted web page	(4 ) swat_initex3	0
CVE-2014-2531++exploitdb++nvd-119	concatenating strings from the application with user input	(2 ) siteworx	0
CVE-2005-1752++ibm++nvd-663	send a specially-crafted url request to the filename parameter in the viewfile.php script to execute arbitrary commands with privileges of the web server	shell metacharacters in the file_name parameter	0
CVE-2010-3447++ibm++nvd-2217	"""using the file parameter in a specially-crafted url to execute script in a victim's web browser within the security context of the hosting web site"""	the file parameter in a view_file action	0
CVE-2014-2364++ibm++nvd-179	sending an overly long string to multiple parameters	(2 ) setparameter	0
CVE-2015-3110++ibm++exploitdb-192	persuading a victim to open a specially-crafted file	edit and compose raster images	1
CVE-2015-6250++openwall++nvd-761	properties of the captcha	running the same code on the client-side	0
CVE-2011-3483++exploitdb++nvd-972	malformed packet trace file	a malformed capture file that leads to an invalid root tvbuff	0
CVE-2014-2364++exploitdb++nvd-2452	user controlled data through the getcolor function	(2 ) setparameter	0
CVE-2014-6269++ibm++nvd-764	sending multiple gigs a remote attacker could overflow a buffer and execute arbitrary code on the system or cause the application to crash .	a large stream of data	0
CVE-2009-3626++ibm++nvd-2327	sending specially-crafted strings containing utf-8 characters within regular expressions	a utf-8 character with a large	1
CVE-2011-1011++ibm++nvd-418	creating a symbolic link from a temporary file to various files on the system	as demonstrated	0
CVE-2014-9119++ibm++openwall-3109	"send a specially-crafted url request to the download.php script containing \\""dot dot\\"" sequences (/../)"	a specially crafted request	1
CVE-2019-16275++ibm++nvd-1428	sending a specially-crafted 802.11 frame	pmf (aka management frame protection). the attacker must send a crafted 802.11 frame from a location that is within the 802.11 communications range	0
CVE-2009-0753++openwall++nvd-2359	using crafted requests to the http console	"a leading ""//"" (double slash ) in the filename"	0
CVE-2008-1080++ibm++openwall-3120	persuading a victim to visit a malicious web page and type target filename characters	images that contain custom comments	0
CVE-2018-1000088++ibm++nvd-2092	"""using oauth client's name to inject malicious script into a web page"""	the victim must be tricked to click an opaque link to the web view that runs the xss payload . a malicious version virtually indistinguishable from a normal link.. this vulnerability appears to have been fixed in 4.2.6	0
CVE-2016-6161++openwall++nvd-124	malformed input with gd2togif	a crafted image	0
CVE-2000-0329++exploitdb++nvd-1055	send it to the target client	"aka the ""active setup control "" vulnerability"	0
CVE-2007-6515++ibm++nvd-60	sending a specially-crafted http request	code separator characters in the query string	1
CVE-2017-6355++ibm++nvd-2344	using specially-crafted pkt_length and offlen values	which trigger an out-of-bounds access	1
CVE-2014-9258++ibm++nvd-3293	send specially-crafted sql statements to the getdropdownvalue.php script using the condition parameter	the condition parameter	1
CVE-2009-0386++openwall++nvd-2261	a crafted quicktime media file	crafted composition time to sample (ctts ) atom data in a malformed quicktime media	0
CVE-2015-5285++exploitdb++openwall-1646	"""the get 'came_from ' parameter in the login instance"""	a malicious request	0
CVE-2012-5002++exploitdb++nvd-2703	user command	a long user ftp command	1
CVE-2014-2364++ibm++nvd-185	sending an overly long string to multiple parameters	(8 ) getcolor	0
CVE-1999-1113++ibm++nvd-125	connecting to tcp port 106 and issuing a user command followed by a string containing 1000 bytes or more	a long user command to port 106	1
CVE-2008-5713++ibm++openwall-270	sending continuous udp packets	sending a large amount of network traffic	1
CVE-2016-6350++openwall++nvd-1779	sysctl on openbsd	a sysctl call with a path starting with 10	1
CVE-2009-0386++openwall++nvd-2260	crafted sync sample (aka stss ) atom data in a malformed quicktime media .mov file	crafted composition time to sample (ctts ) atom data in a malformed quicktime media	1
CVE-2010-1635++ibm++openwall-2955	sending a specially-crafted session setup andx packet	"""sending a specific 'sessions setup andx ' query"""	1
CVE-2003-0763++ibm++nvd-1853	create a malicious url link to a script containing embedded script in the ?page variable	as demonstrated using the page parameter	0
CVE-2011-1169++ibm++openwall-2477	a memory corruption error in the audioscience hpi driver (hpioctl.c). by sending a specially-crafted request	using the appropriate hardware or finding a new way to force it to be loaded in violation of security policy	0
CVE-2015-2562++ibm++nvd-2023	sort_order and filter_manufacturer_ids parameter	(2 ) sort_order	0
CVE-2005-3330++exploitdb++nvd-391	passing this uri to a script that uses a vulnerable version of snoopy	shell metacharacters in an https url to an ssl protected web page	1
CVE-2008-7075++ibm++nvd-1258	send specially-crafted sql statements to multiple scripts	(3 ) article.comments.php	0
CVE-2014-0172++openwall++nvd-1403	malformed compressed debug sections	which triggers a heap-based buffer overflow	0
CVE-2008-2750++ibm++openwall-2719	sending a specially crafted ppp over l2tp packet	a crafted pppol2tp packet	1
CVE-2008-1083++ibm++nvd-1472	persuading a victim to open a specially-crafted emf or wmf file	an emf or wmf image file with a malformed header that triggers an integer overflow	0
CVE-2017-6355++ibm++nvd-2343	using specially-crafted pkt_length and offlen values	crafted pkt_length and offlen values	1
CVE-2011-1496++ibm++nvd-1300	gain elevated privileges	gain utmp group privileges	1
CVE-2016-6350++openwall++nvd-1777	using the sysctl call	a sysctl call with a path starting with 10	1
CVE-2011-3354++ibm++openwall-1203	sending multiple client-to-client protocol (ctcp ) messages	sending specially crafted ctcp requests	1
CVE-2014-5270++ibm++openwall-536	a side-channel attack on elgamal sub-keys	without a large overhead	1
CVE-2015-5285++exploitdb++openwall-386	"""the get 'came_from ' parameter in the login instance"""	inject arbitrary headers into the server response for certain urls	0
CVE-2018-9137++ibm++exploitdb-2356	sending a specially-crafted request	a value that is mishandled in a csv export	0
CVE-2017-15986++ibm++exploitdb-492	"""send specially-crafted sql statements using the 'username ' parameter"""	inject sql commands	0
CVE-2014-4717++ibm++nvd-425	persuading an authenticated user to visit a malicious web site	and unspecified vectors related to (2 ) pages	0
CVE-2008-0853++ibm++nvd-41	send specially-crafted sql statements to the index.php script using the id parameter	the id parameter to index.php	1
CVE-2015-8960++ibm++openwall-269	using man-in-the-middle techniques	engaging in the exact same computation	0
CVE-2005-1070++exploitdb++nvd-2000	"""pass sql statements to the underlying database through the 'st ' parameter"""	the st parameter	0
CVE-2013-4200++ibm++openwall-821	"""possibly retrieve the user's session cookie"""	issuing a specially-crafted request	0
CVE-2011-3596++ibm++nvd-126	sending a specially crafted http post / put request	specially-crafted http post / put request	1
CVE-2004-1973++exploitdb++nvd-3309	a malformed http get request	which consumes resources when digi converts the slashes to \\ (backslash ) characters	0
CVE-2012-2573++exploitdb++nvd-1973	send an email to the victim with the payload in the email body	"or (7 ) a data : url in the content attribute of an http-equiv=""refresh "" meta element"	0
CVE-2014-2364++ibm++nvd-183	sending an overly long string to multiple parameters	(6 ) alarmimage	0
CVE-2005-3388++ibm++nvd-666	create a malicious url containing a specially-crafted stack array assignment to the phpinfo() function containing malicious script which	"a crafted url with a ""stacked array assignment."""	0
CVE-2014-2364++ibm++nvd-178	sending an overly long string to multiple parameters	a long string in the (1 ) projectname	0
CVE-2008-3432++openwall++nvd-2503	copying files	shell metacharacters in filenames	0
CVE-2001-0205++ibm++nvd-772	"request a url containing modified \\""dot dot\\"" sequences"	a modified	0
CVE-2016-4439++openwall++nvd-986	uses 16-byte fifo buffer	unspecified vectors	0
CVE-2010-4646++ibm++nvd-1235	"""a specially-crafted background attribute within a cell in a table element to execute script in a victim's web browser within the security context of the hosting web site"""	related to improper use of the htmlawed filter	1
CVE-2017-14496++ibm++nvd-512	sending a specially-crafted dns request	a crafted dns request	1
CVE-2009-0487++openwall++nvd-1911	a crafted forum post	a crafted forum post	1
CVE-2015-6127++ibm++exploitdb-2124	persuading a victim to open a specially-crafted file	a specially crafted mcl file	0
CVE-2006-6173++exploitdb++nvd-175	specially crafted arguments to a system call	(1 ) a small range count	0
CVE-2008-4194++ibm++openwall-1091	sending an overly long dns reply containing multiple entries in the answer field	a long dns reply with many entries in the answer section	0
CVE-2013-2852++ibm++nvd-38	sending a specially-crafted request containing format string specifiers	leading to improper construction of an error message	0
CVE-2007-6458++ibm++nvd-3263	send specially-crafted sql statements to the mainfile.php file	a base64-encoded value of the admin parameter to shop/admin.php	1
CVE-2014-7841++ibm++openwall-1587	sending a specially-crafted sctp packet	sending a maliciously prepared sctp packet	1
CVE-2008-3971++openwall++nvd-1892	a crafted manpage in    gmanedit	which is not properly handled during utf8 conversion	0
CVE-2016-6835++ibm++openwall-2801	leveraging failure to check ip header length	reading further packet data	0
CVE-2000-0329++exploitdb++nvd-1052	attach the asdf.jpg file	an attachment and an embedded script in an html mail	0
CVE-2016-6350++openwall++nvd-1775	manage to map a page at address zero	a sysctl call with a path starting with 10	1
CVE-2013-5961++ibm++nvd-280	sending a specially-crafted http request	a direct request to the file in lazy-seo/.	0
CVE-2014-2364++exploitdb++nvd-2455	user controlled data through the getcolor function	(5 ) setcolor	0
CVE-2001-0205++ibm++nvd-771	"request a url containing modified \\""dot dot\\"" sequences"	"inserting ""..."" into the requested pathname"	0
CVE-2014-4717++ibm++nvd-426	persuading an authenticated user to visit a malicious web site	(3 ) posts	0
CVE-2018-11793++ibm++openwall-1865	using specially-crafted json structures	a malicious actor	0
CVE-2020-10648++ibm++openwall-3318	persuading a victim to open a specially-crafted fit image	verify integrity and authenticity of the loaded images	1
CVE-2015-6104++ibm++nvd-2730	persuading a victim to open specially-crafted content	a crafted embedded font	1
CVE-2016-10109++openwall++nvd-1513	a malicious client	"a command that uses ""cardslist "" after the handle has been released through the scardreleasecontext function"	0
CVE-2015-8079++ibm++openwall-1223	the disclosure of urls visited during private browsing mode in in webpageicons.db	records visited urls in private browsing	0
CVE-2017-9417++ibm++nvd-975	using unknown attack vectors	"aka the ""broadpwn "" issue"	0
CVE-2006-0715++ibm++exploitdb-147	"""steal the victim's cookie-based authentication credentials"""	control how the site is rendered to the user	0
CVE-2005-3507++ibm++nvd-2433	send a specially-crafted url	"""../"" sequences in the template parameter to (1 ) show_archives.php and (2 ) show_news.php ."	0
CVE-2006-5276++exploitdb++nvd-2330	sending malformed smb packet	crafted smb traffic	1
CVE-2016-10207++ibm++nvd-156	terminating a tls handshake	terminating a tls handshake early	1
CVE-2013-1752++ibm++openwall-681	an unlimited readline() function call	no fix had been released	0
CVE-2012-2020++ibm++nvd-248	sending specially-crafted packet	aka zdi-can-1326	0
CVE-2017-8926++ibm++nvd-2507	persuading a victim to open a specially-crafted tif file	a crafted	0
CVE-2015-1416++ibm++nvd-702	using a specially-crafted patch file	a crafted patch file	0
CVE-2011-2702++openwall++nvd-1671	a denial of service	execute arbitrary code	0
CVE-2011-3378++ibm++nvd-5	persuading a victim to check signatures of a specially crafted rpm package	an rpm package with crafted headers and offsets that are not properly handled when a package is queried or installed	0
CVE-2012-2573++exploitdb++nvd-1985	crating a new contact	(5 ) a crafted src attribute of an iframe element	0
CVE-2008-5517++openwall++nvd-1772	using quote_command()	shell metacharacters related to (1 ) git_snapshot and (2 ) git_object	0
CVE-2011-1657++openwall++nvd-2026	crashes on invalid flags	as demonstrated by (a ) glob_altdirfunc and (b ) glob_append	0
CVE-2001-1178++ibm++exploitdb-1188	inserting 7 kb of characters into the manpath environment variable	inserting 70000 characters into the manpath variable	1
CVE-2013-2108++ibm++exploitdb-2264	web cache poisoning	perform certain unauthorized actions in the context of the affected application	0
CVE-2005-3518++ibm++nvd-1037	send a specially-crafted search request containing a sql statement to the search.php script using the old_searches parameter	the old_searches parameter	0
CVE-2009-3626++ibm++nvd-2328	sending specially-crafted strings containing utf-8 characters within regular expressions	invalid codepoint	1
CVE-2014-2364++exploitdb++nvd-2461	user controlled data through the getcolor function	or (11 ) ipaddress parameter to an activex control in (a ) webvact.ocx	0
CVE-2013-1860++ibm++nvd-1488	using unknown attack vectors	a crafted cdc-wdm usb device	0
CVE-2015-1328++ibm++openwall-1097	incorrect permission checks when creating new files in the upper filesystem directory by the overlayfs filesystem	creating a 1:1 copy of a root-owned file	0
CVE-2017-17095++ibm++exploitdb-522	persuading a victim to open a specially-crafted file	imagewidth and imagelength of the input tiff file	0
CVE-2011-4357++openwall++nvd-566	a specially-crafted input	format string specifiers that are not properly handled when creating cgi error messages using the cgi_error api function	0
CVE-2009-4222++ibm++nvd-2442	sending a direct request	a direct request	1
CVE-2004-2120++ibm++nvd-3131	send multiple http get requests for a file that exists on the server	multiple incomplete get requests without the http version	1
CVE-2017-7585++ibm++nvd-2894	persuading a victim to open a specially-crafted flac file	a specially crafted flac file	1
CVE-2014-0172++openwall++nvd-1402	malformed compressed debug sections	a malformed compressed debug section in an elf file	1
CVE-2007-1842++ibm++nvd-1219	send a specially-crafted url request to the login.php script using the table parameter to specify a malicious file from the local system	a .. (dot dot ) in the table parameter	0
CVE-2011-3619++openwall++nvd-3160	doing an invalid formatted write to the process	does not properly handle invalid parameters	0
CVE-2004-2617++ibm++exploitdb-2786	"send a specially-crafted http request to the server containing \\""dot dot\\"" (/../) sequences to traverse directories and view any file on the web server"	request files outside of the web-server root directory	0
CVE-2007-6581++ibm++nvd-2270	send a specially-crafted url request to multiple scripts using the global_lang parameter to specify a malicious file from the local system	(2 ) header_blog.php	0
CVE-2017-12923++ibm++openwall-79	persuading a victim to open a specially-crafted file	a read memory access	0
CVE-2004-0445++ibm++nvd-2861	sending a specially-crafted dns response packet from udp port 53 that contains a compressed name pointer	a dns response with a compressed name pointer that points to itself	1
CVE-2009-3223++exploitdb++nvd-1957	create an advertiser account to the site	the id parameter	0
CVE-2017-15367++exploitdb++nvd-95	depending on configuration	access the bacula database and	1
CVE-2008-2520++ibm++nvd-284	send a specially-crafted url request to the function.captcha.php	different vectors than cve-2006-4423	0
CVE-2010-4524++openwall++nvd-3202	a specially-crafted email    message	as demonstrated by <scr<body>ipt > and </scr<body>ipt > sequences	0
CVE-2005-3811++ibm++nvd-760	send a specially-crafted request to the admin/main.php script using the sid parameter to overwrite arbitrary files with session information using directory traversal attacks	the sid parameter	0
CVE-2013-4160++ibm++nvd-1358	persuading a victim to open a specially-crafted image file	vectors related to (1 ) cmsstagealloclabv2tov4curves	0
CVE-2004-1620++ibm++nvd-2232	send a specially-crafted request to cause the server to return a split response	or (3 ) the http referer field in comment.php	0
CVE-2011-0640++openwall++nvd-49	malicious usb devices	as demonstrated by keyboard and mouse data sent by malware on a smartphone that the user connected to the computer	1
CVE-2009-1759++ibm++exploitdb-1537	persuading a victim to open a specially-crafted torrent file	change the addr to hit the nop sled	0
