CVE-2015-5243++ibm++openwall-2189	sending a specially-crafted request	a simple whois server implementation	0
CVE-2016-4439++openwall++nvd-985	"""writing to 's->cmdbuf'"""	unspecified vectors	0
CVE-2015-4153++ibm++exploitdb-2041	send a specially-crafted url request to the load_template module using the template parameter to specify a malicious file from the local system	exploiting the wp_ajax_nopriv_load_template action	0
CVE-2011-1087++ibm++openwall-455	persuading a victim to open a specially-crafted .mp3 file and then creating a bookmark for the affected file	creating a bookmark from the malicious media file playing	0
CVE-2019-0192++ibm++openwall-2998	sending a specially-crafted request	jmx.serviceurl	0
CVE-2007-6038++ibm++nvd-1681	specify a malicious file from a remote system	a url in the mosconfig_absolute_path parameter	0
CVE-2000-0329++exploitdb++nvd-1065	build the cab file	"aka the ""active setup control "" vulnerability"	0
CVE-2014-7841++ibm++openwall-1589	sending a specially-crafted sctp packet	malformed	1
CVE-2016-4485++ibm++nvd-2939	an attacker could exploit this vulnerability to obtain sensitive information .	reading a message	0
CVE-2008-3432++ibm++nvd-104	persuading a victim to open a specially-crafted file or directory with a malformed name	shell metacharacters in filenames	0
CVE-2015-8104++openwall++nvd-3045	triggering an infinite	triggering many #db (aka debug ) exceptions	1
CVE-2010-2752++ibm++nvd-1840	persuading a victim to visit a specially-crafted web site	related to references to external font resources and an inconsistency between 16-bit and 32-bit integers	0
CVE-2015-4171++openwall++nvd-2897	"using username ""alice "" and a password"	using a valid certificate and then reading the responses	1
CVE-2009-0753++exploitdb++openwall-2185	supplying a special-crafted request	using crafted requests to the http console	0
CVE-2009-1194++openwall++nvd-3271	creating an overly large document.location value but only results in a process-terminating	a long glyph string that triggers a heap-based buffer overflow	0
CVE-2016-5108++openwall++nvd-2237	processing quicktime ima files	a crafted quicktime ima file	1
CVE-2010-3088++openwall++nvd-643	sending a prepared message	shell metacharacters in a message	0
CVE-2010-5325++ibm++nvd-3057	sending an overly long argument	a long job title	0
CVE-2012-2573++exploitdb++nvd-1968	send an email to the victim with the payload in the email body	(2 ) a crafted cascading style sheets (css ) expression property	0
CVE-2012-2573++exploitdb++nvd-1972	send an email to the victim with the payload in the email body	"(6 ) a crafted content attribute of an http-equiv=""refresh "" meta element"	0
CVE-2012-0845++ibm++openwall-3008	sending a specially-crafted http post request	malformed xml-rpc /	0
CVE-2017-12923++openwall++nvd-3282	manipulating flashpix images	a crafted fpx image	0
CVE-2011-0640++ibm++nvd-964	persuading a victim to connect a malicious usb device	crafted usb data	0
CVE-2003-1604++ibm++nvd-1012	sending packets to an interface that has a 0.0.0.0 ip address	sending packets to an interface that has a 0.0.0.0 ip address	1
CVE-2015-8540++ibm++nvd-258	sending an overly long argument	which triggers an out-of-bounds read	0
CVE-2018-18557++ibm++exploitdb-1072	persuading a victim to open a specially-crafted file	write a pretty arbitrary amount of data of his choosing into this buffer	0
CVE-2017-9417++ibm++exploitdb-2967	using unknown attack vectors	"""write to the device's main cpu kernel"""	0
CVE-2009-0447++ibm++nvd-2044	send specially-crafted sql statements to the default.asp script using the uri or user or pass parameter	(1 ) the user parameter (aka username field ) or (2 ) the pass parameter (aka pass field ) to (a ) admin/admin.asp or (b ) the default uri under admin/. note : some of these details are obtained from third party information	0
CVE-2013-2852++ibm++nvd-37	sending a specially-crafted request containing format string specifiers	leveraging root access and including format string specifiers in an fwpostfix modprobe parameter	0
CVE-2008-5286++ibm++nvd-314	a png image containing a large height value	which bypasses a validation check and triggers a buffer overflow	1
CVE-2013-2730++ibm++nvd-1859	persuading a victim to visit a specially-crafted web site	a different vulnerability than cve-2013-2733	0
CVE-2016-5418++openwall++nvd-950	using 900k*4 compression * to bump up the tv[1-3 ] page count	a crafted archive file	0
CVE-2014-7841++ibm++openwall-1588	sending a specially-crafted sctp packet	malformed packet	1
CVE-2014-8177++ibm++openwall-3198	the failure to enforce metadata constraints	adding metadata in several separate calls	0
CVE-2007-5996++ibm++nvd-407	send specially-crafted sql statements to the searchresult.php script using the sbcat_id parameter	a related issue to cve-2007-5449	1
CVE-2000-0329++exploitdb++nvd-1054	send it to the target client	an attachment and an embedded script in an html mail	0
CVE-2004-1620++ibm++nvd-2231	send a specially-crafted request to cause the server to return a split response	the url parameter in (1 ) index.php and (2 ) exit.php	0
CVE-2012-2127++ibm++openwall-2760	making many connections to a daemon that uses pid namespaces to isolate clients	a namespace enabled vsftpd remotely	1
CVE-2010-2959++ibm++exploitdb-2736	sending specially-crafted can traffic	setting up a truncated memory mapping as the source for the memcpy_fromiovec operation	0
CVE-2011-0640++openwall++nvd-51	an end-user-consumable kernel update	as demonstrated by keyboard and mouse data sent by malware on a smartphone that the user connected to the computer	1
CVE-2010-4524++openwall++nvd-3201	a specially-crafted email    message	a malformed start tag and end tag for a script element	0
CVE-2017-12923++openwall++nvd-3281	a read memory access	a crafted fpx image	0
CVE-2009-3890++ibm++nvd-2157	posting an attachment with a multiple-extension filename	a direct request to a wp-content/uploads / pathname	0
CVE-2011-4925++openwall++nvd-1843	using munge	unspecified vectors	0
CVE-2013-4579++exploitdb++nvd-3101	flip the bit at current position	sending a series of packets to mac addresses with certain bit manipulations	0
CVE-2004-2617++ibm++exploitdb-1386	"send a specially-crafted http request to the server containing \\""dot dot\\"" (/../) sequences to traverse directories and view any file on the web server"	request files outside of the web-server root directory	1
CVE-2017-15924++ibm++nvd-505	sending a specially-crafted request	shell metacharacters in a json configuration request received via 127.0.0.1 udp traffic	0
CVE-2007-2820++ibm++nvd-2032	persuading a victim to visit a specially-crafted web page	long arguments to the (1 ) swat_init	0
CVE-2011-3354++openwall++nvd-1835	sending specially crafted ctcp requests	a crafted client-to-client protocol (ctcp ) request	1
CVE-2016-7185++exploitdb++nvd-3225	removing the letter from our current user dos devices directory	a crafted application	0
CVE-2010-1173++openwall++nvd-594	malformatted init package	an sctpchunkinit packet containing multiple invalid parameters that require a large amount of error data	0
CVE-2015-8104++openwall++nvd-3044	"triggering an infinite stream of ""debug check "" (#db ) exceptions"	related to svm.c	1
CVE-2008-4667++ibm++nvd-2560	send a specially-crafted url request to the rss.php script using the rss parameter to specify a malicious file from the local system	a .. (dot dot ) in the rss parameter .	1
CVE-2014-2531++exploitdb++nvd-120	concatenating strings from the application with user input	or (3 ) resellers interface	0
CVE-2011-0708++openwall++nvd-1199	work with image metadata within their php code	an image with a crafted image file directory (ifd ) that triggers a buffer over-read	0
CVE-2016-6185++ibm++nvd-1961	sending specially crafted data to the xsloader component	a trojan horse library under the current working directory	0
CVE-2017-5970++openwall++nvd-1700	sending bad ip options on a socket	(1 ) an application that makes crafted system calls or possibly (2 ) ipv4 traffic with invalid ip options	0
CVE-2013-4837++exploitdb++nvd-2053	autodeploy on the webapps directory	unknown vectors	0
CVE-2009-1210++ibm++openwall-922	sending specially-crafted packets captured off the wire containing malicious format string specifiers in the station name	a pn-dcp packet with format string specifiers in the station name	0
CVE-2017-15367++exploitdb++nvd-93	access the bacula database and	depending on configuration	1
CVE-2013-2730++ibm++nvd-1858	persuading a victim to visit a specially-crafted web site	unspecified vectors	0
CVE-2000-1054++ibm++exploitdb-609	sending an oversized packet to tcp port 2002	an oversized packet	1
CVE-2014-2364++exploitdb++nvd-2462	user controlled data through the getcolor function	(b ) dvs.ocx	0
CVE-2006-0214++ibm++nvd-1145	send a specially-crafted url request to the visitorupload.php script that specifies a malicious file on a local or remote system using the db_id parameter	the db_id parameter to visitorupload.php	0
CVE-2014-9099++ibm++nvd-2559	persuading an authenticated user to visit a malicious web site	a request to the whydowork_adsense page in wp-admin/options-general.php	1
CVE-2007-6581++ibm++nvd-2273	send a specially-crafted url request to multiple scripts using the global_lang parameter to specify a malicious file from the local system	or (6 ) admin_header_group.php in admin/.	0
CVE-2017-12924++openwall++nvd-1585	manipulating flashpix images	a crafted fpx image	1
CVE-2017-17576++ibm++exploitdb-2095	send specially-crafted sql statements to the browse-category.php	inject sql commands	0
CVE-2008-1483++openwall++nvd-1997	causing ssh to set display to :10	as demonstrated	1
CVE-2016-8680++ibm++nvd-1302	calling the dwarfdump command on a specially-crafted file	calling the dwarfdump command on a crafted file	1
CVE-2011-1930++openwall++nvd-1727	checking ipconfig backlog patches	send a specially crafted dhcp reply	0
CVE-2018-8947++ibm++nvd-2164	sending a specially-crafted request	a dl request	0
CVE-2013-4837++exploitdb++nvd-2509	upload arbitrary files	execute arbitrary code	0
CVE-2011-4357++openwall++nvd-878	a specially-crafted input	format string specifiers that are not properly handled when creating cgi error messages using the cgi_error api function	0
CVE-2009-0386++ibm++nvd-1314	persuading a victim to open a specially-crafted quicktime media file	crafted composition time to sample (ctts ) atom data in a malformed quicktime media	0
CVE-2013-4200++ibm++openwall-818	"""possibly retrieve the user's session cookie"""	a specially-crafted url	0
CVE-2008-7075++ibm++nvd-1260	send specially-crafted sql statements to multiple scripts	or (5 ) article.download.php ; and (6 ) the path_info to article.download.php	0
CVE-2010-1601++ibm++nvd-983	send a specially-crafted url request to the index.php script using the view parameter to specify a malicious file from the local system	a .. (dot dot ) in the view parameter to index.php .	0
CVE-2006-3931++ibm++exploitdb-2040	attempting to record a midi file with an overly long filename	using it in a finite-sized buffer	0
CVE-2018-18557++ibm++exploitdb-1073	persuading a victim to open a specially-crafted file	perform an allocation of a size of his choosing	0
CVE-2011-1071++ibm++nvd-1252	persuading the application into using the function	a long utf8 string that is used in an fnmatch call	0
CVE-2001-0552++ibm++exploitdb-1309	send a specially-crafted trap	execute commands on a managed system with the privileges of the ovactiond process	0
CVE-2020-12695++ibm++openwall-2544	the failure to forbid the acceptance of a subscription request with a delivery url on a different network segment	removing the upnp_iface parameter	0
CVE-2018-11714++ibm++nvd-618	sending a specially-crafted request	improper session handling on the /cgi / folder or a /cgi file	0
CVE-2011-0640++openwall++nvd-52	connect an object of their choice to a usb port	crafted usb data	1
CVE-2008-2520++ibm++nvd-282	send a specially-crafted url request to the function.captcha.php	a url in the (1 ) globals[_bigace][dir][addon ] parameter to (a ) addon/smarty/plugins/function.captcha.php and (b ) system/classes/sql/adodbconnection.php ; and the (2 ) globals[_bigace][dir][admin ] parameter to (c ) item_information.php and (d ) jstree.php in system/application/util/	0
CVE-2015-8079++ibm++openwall-1224	the disclosure of urls visited during private browsing mode in in webpageicons.db	using private browsing mode	0
CVE-2006-0214++ibm++nvd-150	send a specially-crafted url request to the visitorupload.php script that specifies a malicious file on a local or remote system using the db_id parameter	the db_id parameter to visitorupload.php	1
CVE-2016-7162++ibm++nvd-2352	creating a symbolic link from a temporary file to various files on the system	a symlink attack on a folder in an archive	1
CVE-2015-1463++ibm++nvd-1672	using specially-crafted petite packer files	a crafted petite packer file	1
CVE-2012-5329++ibm++nvd-1276	sending a specially-crafted appe	a long string in an appe command	0
CVE-2008-2245++ibm++nvd-115	persuading a victim to open a specially-crafted image file	a crafted image file	1
CVE-2014-5368++ibm++nvd-2800	"send a specially-crafted url request to the wp-source-control/downloadfiles/download.php script containing \\""dot dot\\"" sequences (/../) in the path parameter to view arbitrary files on the system"	a .. (dot dot ) in the path parameter .	1
CVE-2007-2192++ibm++nvd-114	creating a specially-crafted tif file	a crafted	1
CVE-2018-13417++exploitdb++nvd-209	hosting a specially crafted xml file at that location	access arbitrary files from the filesystem with the same permission as the user account running vuze	0
CVE-2005-0944++ibm++nvd-2214	sending a specially-crafted .mdb database file	a crafted mdb file	1
CVE-2009-1573++openwall++nvd-3239	the commandline	listing the process and its arguments	1
CVE-2011-0640++openwall++nvd-48	malicious usb devices	crafted usb data	1
CVE-2007-6746++ibm++openwall-1423	persuading a victim to visit a web site containing a specially-crafted certificate	not check ssl certificates	0
CVE-2017-7411++ibm++openwall-740	using specially-crafted serialized objects	using the unserialize() function with a value	1
CVE-2018-5391++ibm++nvd-875	sending specially crafted ip fragments with random offsets	sending specially crafted ip fragments	0
CVE-2014-8681++ibm++exploitdb-2547	send specially-crafted sql statements to the issue.go script using the labels parameter	extract data with a binary search	0
CVE-2010-4262++ibm++openwall-1243	persuading a victim to open a specially-crafted .fig file with color definition	processing fig	0
CVE-2017-17620++exploitdb++nvd-2920	inject sql commands	the /lawyer-list city parameter	0
CVE-2012-2573++exploitdb++nvd-1967	send an email to the victim with the payload in the email body	an e-mail message body with (1 ) a script element	0
CVE-2017-16642++ibm++nvd-1449	sending a specially-crafted request	attackers able to supply date strings to leak information from the interpreter	0
CVE-2007-2820++ibm++nvd-2036	persuading a victim to visit a specially-crafted web page	and (5 ) swat_login functions	0
CVE-2009-1758++openwall++nvd-2600	"triggering a segmentation fault in ""certain address ranges"	"triggering a segmentation fault in ""certain address ranges."""	1
CVE-2009-1943++ibm++nvd-1659	sending an overly long request to udp port 62514	a long request to udp port 62514	1
CVE-2017-12920++ibm++openwall-1453	persuading a victim to open a specially-crafted file	a read memory access	0
CVE-2000-0329++exploitdb++nvd-1061	process the unsigned cab file	"aka the ""active setup control "" vulnerability"	0
CVE-2010-4111++ibm++nvd-2705	"""a specially-crafted url to execute script in a victim's web browser within the security context of the hosting web site"""	unspecified vectors	0
CVE-2013-2241++ibm++openwall-3105	improper user access verification by the data_rest core module	fixing two security flaws	0
CVE-2000-0329++exploitdb++nvd-1059	execute vbscript from the same email message	"aka the ""active setup control "" vulnerability"	0
CVE-2012-2573++exploitdb++nvd-1983	crating a new contact	(3 ) a css expression property in the style attribute of an arbitrary element	0
CVE-2019-12415++ibm++openwall-554	an xml external entity (xxe ) error when processing xml data by tool xssfexporttoxml	a specially crafted document	0
CVE-2015-5285++openwall++nvd-1003	inject arbitrary headers into the server responses	inject arbitrary http headers and conduct http response splitting attacks	0
CVE-2010-4352++ibm++openwall-692	sending a specially-crafted d-bus message containing an overly large number of nested variants	a specially-crafted message sent to the system bus	0
CVE-2006-0214++ibm++nvd-151	send a specially-crafted url request to the visitorupload.php script that specifies a malicious file on a local or remote system using the db_id parameter	as demonstrated using phpinfo and include function calls	1
CVE-2008-7075++ibm++nvd-1259	send specially-crafted sql statements to multiple scripts	(4 ) article.publisher.php	0
CVE-2009-2999++openwall++nvd-3178	a specific malformed sms message	an sms message containing a malformed wap push message that triggers an arrayindexoutofboundsexception exception	0
CVE-2009-3579++openwall++nvd-1305	the value parameter in a get request to cookie/	the value parameter in a get request to cookie/.	1
CVE-2004-0200++ibm++exploitdb-433	creating a specially-crafted jpeg file containing malicious code	put approx 2500 bytes of shellcode	0
CVE-2015-6250++openwall++nvd-2001	properties of the captcha	running the same code on the client-side	0
CVE-2006-6173++exploitdb++nvd-177	specially crafted arguments to a system call	or (2 ) a large number of ranges in the shared_region_make_private_np_args parameter	0
CVE-2009-0751++ibm++nvd-2093	sending an overly large number of header requests	a request with a large number of headers	0
CVE-2015-2562++ibm++nvd-2021	send specially-crafted sql statements using the search_category_id	or (3 ) filter_manufacturer_ids in a displayproducts action to index.php	0
CVE-2015-8618++ibm++openwall-2592	sending a specially-crafted packet	crafting specific inputs	1
CVE-2016-1568++ibm++nvd-1697	sending a specially crafted ahci native command queuing aio command	an invalid ahci native command queuing (ncq ) aio command	1
CVE-2008-0394++ibm++nvd-807	"sending an overly long argument to the \\""rcpt to\\"" smtp command"	which is not properly handled by the makeuserkey function	0
CVE-2009-1955++ibm++openwall-2951	consume all available memory resources	a denial of service	0
CVE-2011-1493++ibm++nvd-3247	composing fac_national_digis data that specifies a large number of digipeaters	composing fac_national_digis data that specifies a large number of digipeaters	1
CVE-2000-0329++exploitdb++nvd-1058	execute vbscript from the same email message	an attachment and an embedded script in an html mail	0
CVE-2020-10648++ibm++openwall-3319	persuading a victim to open a specially-crafted fit image	craft another configuration with the same signature node	1
CVE-2006-6173++exploitdb++nvd-176	specially crafted arguments to a system call	which causes insufficient memory allocation	0
CVE-2017-0144++exploitdb++nvd-3242	open named pipe	crafted packets	0
CVE-2010-2959++ibm++exploitdb-2735	sending specially-crafted can traffic	corrupting bcm op with truncated allocation	0
CVE-2012-2573++exploitdb++nvd-1976	send an email to the victim with the payload in the e-mail body	(3 ) a css expression property in the style attribute of an arbitrary element	0
CVE-2014-0172++ibm++nvd-944	persuading a victim to open a specially-crafted elf file	a malformed compressed debug section in an elf file	1
CVE-2018-1002150++ibm++openwall-1931	sending a specially-crafted request	manipulation of the koji filesystem	0
CVE-2009-0487++ibm++nvd-404	using forum posts to inject malicious script into a web page	a crafted forum post	0
CVE-2008-1162++ibm++nvd-3103	send specially-crafted sql statements to the album.php script using the albumid parameter	the albumid parameter	1
CVE-2015-8813++ibm++openwall-1201	improper validation of user-supplied input by the feedproxy.aspx script	using this payload change the port number to perform port scanning > of the > server	0
CVE-2017-1002026++ibm++nvd-879	"""send specially-crafted sql statements using the 'id ' parameter"""	the $id parameter before passing it into an sql statement	1
CVE-2015-6127++ibm++exploitdb-2125	persuading a victim to open a specially-crafted file	sent through the full disclosure mailing list	0
CVE-2018-9059++ibm++nvd-1824	sending a specially crafted packet	a malicious login request to forum.ghp	0
CVE-2014-1912++ibm++nvd-912	sending an overly long argument	a crafted string	0
CVE-2012-0882++ibm++nvd-359	using unknown attack vectors	as demonstrated by vulndisco pack professional 9.17	1
CVE-2020-10648++ibm++openwall-3321	persuading a victim to open a specially-crafted fit image	craft arbitrary fit images	1
CVE-2014-2364++ibm++nvd-181	sending an overly long string to multiple parameters	(4 ) ccdparameter	0
CVE-2008-4711++ibm++nvd-2489	send specially-crafted sql statements to multiple scripts using the id parameter	the id parameter to (1 ) view.blog.php	0
CVE-2016-8740++ibm++nvd-2758	sending a specially crafted request	crafted continuation frames in an http/2 request	1
CVE-2008-0853++ibm++nvd-3061	send specially-crafted sql statements to the index.php script using the id parameter	the id parameter to index.php	1
CVE-2010-0519++ibm++nvd-1815	persuading a victim to open a specially-crafted flashpix encoded movie file	a flashpix image with a malformed subimage header stream containing a numberoftiles field with a large value	0
CVE-2015-8618++openwall++nvd-653	crafting specific inputs	unspecified vectors	0
CVE-2014-4998++openwall++nvd-620	the #{ user } and #{ password } variables	listing the process	0
CVE-2013-4200++ibm++openwall-820	"""possibly retrieve the user's session cookie"""	forgotten password email functionality	0
CVE-2010-3085++ibm++nvd-2622	persuading a victim to connect to a malicious mednafen server	unspecified vectors	0
CVE-2013-4200++ibm++openwall-819	"""possibly retrieve the user's session cookie"""	specially-crafted archive	0
CVE-2017-12923++ibm++openwall-80	persuading a victim to open a specially-crafted file	manipulating flashpix images	0
CVE-2014-2364++exploitdb++nvd-2459	user controlled data through the getcolor function	(9 ) serverresponse	0
CVE-2005-4049++ibm++nvd-2656	send specially-crafted sql statements to the index.php script using the cat parameter or to the blog.php script using the note parameter to add	(1 ) the cat parameter in index.php and (2 ) the note parameter in blog.php	1
CVE-2009-0240++openwall++nvd-1741	not properly implement access control checks	a modified repname parameter	0
CVE-2018-17141++ibm++openwall-811	the code handling fax page reception in jpeg support function	processing an specially crafted input	0
CVE-2010-1635++ibm++openwall-2956	sending a specially-crafted session setup andx packet	"""a session setup andx request with the smb header > 'flags2 ' set to '0x8003 '"""	0
CVE-2015-6127++exploitdb++nvd-539	sent through the full disclosure mailing list	a crafted	0
CVE-2015-1328++ibm++openwall-1099	incorrect permission checks when creating new files in the upper filesystem directory by the overlayfs filesystem	"switching ""upper "" to be the lowerdir option"	0
CVE-2014-9275++ibm++nvd-1658	persuading a victim to open a specially-crafted rtf file	a crafted rtf file	1
CVE-2011-1761++ibm++nvd-2618	persuading a victim to open a specially-crafted abc file	a crafted abc file	1
CVE-2016-6161++ibm++nvd-1990	sending specially crafted files	a crafted image	0
CVE-2000-0329++exploitdb++nvd-1056	splitting up our code into two functions	an attachment and an embedded script in an html mail	0
CVE-2010-1744++ibm++nvd-730	send specially-crafted sql statements to the products.html page using the id parameter	the id parameter	0
CVE-2010-2752++ibm++nvd-1839	persuading a victim to visit a specially-crafted web site	placing many cascading style sheets (css ) values in an array	0
CVE-2000-0329++exploitdb++nvd-1063	process the components of the cab file	"aka the ""active setup control "" vulnerability"	0
CVE-2013-2108++ibm++exploitdb-2263	perform cross-site scripting attacks	perform certain unauthorized actions in the context of the affected application	1
CVE-2011-3354++openwall++nvd-1836	sending specially crafted ctcp requests	as demonstrated in the wild in september 2011	0
CVE-2006-1194++ibm++nvd-1573	send a specially-crafted packet containing a overly large value in the commandlength field to cause a denial of service	a packet with a large command length value	1
CVE-2008-4870++ibm++nvd-824	the dovecot.conf file having world-readable permissions	uses world-readable permissions for dovecot.conf	0
CVE-2019-0192++ibm++openwall-2999	sending a specially-crafted request	an http post request	0
CVE-2011-1493++ibm++nvd-3248	composing fac_national_digis data that specifies a large number of digipeaters	and then sending this data to a rose socket	1
CVE-2015-8612++ibm++nvd-3153	leveraging the dhcp_handler argument	the dhcp_handler argument	1
CVE-2008-1080++ibm++openwall-3118	persuading a victim to visit a malicious web page and type target filename characters	typing the characters of the target filename into a file input	1
CVE-2017-17581++ibm++nvd-2310	"""send specially-crafted sql statements to the itechd.php script using the 'productid ' parameter"""	the itechd.php productid parameter	1
CVE-2017-9502++ibm++openwall-340	sending a specially-crafted file url	copy the path with a wrong offset	0
CVE-2009-1194++openwall++nvd-3272	creating an overly large document.location value but only results in a process-terminating	as demonstrated by a long document.location value in firefox	0
CVE-2011-3378++ibm++nvd-7	persuading a victim to check signatures of a specially crafted rpm package	(2 ) the headerload function	0
